{
  "task_id": "fix_configuration_finish_framed_terminal_775",
  "case_id": "configuration_finish_framed_terminal",
  "why": "Protocol 775 Configuration finish_configuration must dispatch through Stevenarella packet_by_id in both directions using the official framed packet ids and body bytes generated by the oracle answer; the official packet INSTANCE terminal flags are recorded in the same answer artifact.",
  "what": "The exact Rust oracle test panics while exercising packet::packet_by_id(775, State::Configuration, Direction::Serverbound, packet id 3, official empty body bytes) because the current Protocol 775 Configuration table has no mapping for packet id 0x03.",
  "answer_path": "oracle/answers/775/configuration_finish_framed_terminal.answer.jsonl",
  "contract_path": "oracle/contracts/775/configuration_finish_framed_terminal.contract.json",
  "failing_test": "cargo test --manifest-path oracle/rust-tests/Cargo.toml --test oracle_contracts configuration_finish_framed_terminal_matches_official_oracle_answer -- --exact",
  "allowed_write_scope": [
    "stevenarella/protocol/src/protocol/mod.rs",
    "stevenarella/protocol/src/protocol/packet.rs",
    "stevenarella/protocol/src/protocol/versions/v26_1_2.rs"
  ],
  "forbidden_paths": [
    "oracle/cases/775/configuration_finish_framed_terminal.json",
    "oracle/contracts/775/configuration_finish_framed_terminal.contract.json",
    "oracle/answers/775/configuration_finish_framed_terminal.answer.jsonl",
    "oracle/test-manifests/775/configuration_finish_framed_terminal.test-manifest.json",
    "oracle/failures/775/configuration_finish_framed_terminal.why-what-answer.jsonl"
  ],
  "stop_condition": "bash oracle/scripts/run_jar_backed_oracle_tests.sh passes without editing oracle expected-answer artifacts."
}
