{
  "task_id": "fix_configuration_custom_click_action_framed_dispatch_775",
  "case_id": "configuration_custom_click_action_framed_dispatch",
  "why": "Protocol 775 Configuration serverbound minecraft:custom_click_action must dispatch through Stevenarella packet_by_id using the official framed packet id and body bytes generated by the oracle answer. This is packet-support evidence only, not UI behavior, command execution, interaction readiness, Configuration completion, or Play readiness.",
  "what": "The exact Rust oracle test panics while exercising packet::packet_by_id(775, State::Configuration, Direction::Serverbound, packet id 8, official body bytes) because the current Protocol 775 Configuration table has no serverbound mapping for packet id 0x08.",
  "answer_path": "oracle/answers/775/configuration_custom_click_action_framed_dispatch.answer.jsonl",
  "contract_path": "oracle/contracts/775/configuration_custom_click_action_framed_dispatch.contract.json",
  "failing_test": "cargo test --manifest-path oracle/rust-tests/Cargo.toml --test oracle_contracts configuration_custom_click_action_framed_dispatch_matches_official_oracle_answer -- --exact",
  "allowed_write_scope": [
    "stevenarella/protocol/src/protocol/mod.rs",
    "stevenarella/protocol/src/protocol/packet.rs",
    "stevenarella/protocol/src/protocol/versions/v26_1_2.rs"
  ],
  "forbidden_paths": [
    "oracle/cases/775/configuration_custom_click_action_framed_dispatch.json",
    "oracle/contracts/775/configuration_custom_click_action_framed_dispatch.contract.json",
    "oracle/answers/775/configuration_custom_click_action_framed_dispatch.answer.jsonl",
    "oracle/test-manifests/775/configuration_custom_click_action_framed_dispatch.test-manifest.json",
    "oracle/failures/775/configuration_custom_click_action_framed_dispatch.why-what-answer.jsonl"
  ],
  "stop_condition": "The exact Rust oracle test passes, then bash oracle/scripts/run_jar_backed_oracle_tests.sh passes without editing oracle expected-answer artifacts."
}
