{
  "task_id": "fix_handshake_intention_framed_dispatch_775",
  "case_id": "handshake_intention_framed_dispatch",
  "why": "Protocol 775 Handshaking serverbound minecraft:intention must dispatch through Stevenarella packet_by_id using the official framed packet id and body bytes generated by the oracle answer. This is packet framing/dispatch/decode evidence only, not Login authentication, Configuration entry, or client-load completion.",
  "what": "The exact Rust oracle test aborts while exercising packet::packet_by_id(775, State::Handshaking, Direction::Serverbound, packet id 0, official intention body bytes) because the current Protocol 775 version table has no Handshaking serverbound mapping.",
  "answer_path": "oracle/answers/775/handshake_intention_framed_dispatch.answer.jsonl",
  "contract_path": "oracle/contracts/775/handshake_intention_framed_dispatch.contract.json",
  "failing_test": "cargo test --manifest-path oracle/rust-tests/Cargo.toml --test oracle_contracts handshake_intention_framed_dispatch_matches_official_oracle_answer -- --exact",
  "allowed_write_scope": [
    "stevenarella/protocol/src/protocol/versions/v26_1_2.rs"
  ],
  "forbidden_paths": [
    "oracle/cases/775/handshake_intention_framed_dispatch.json",
    "oracle/contracts/775/handshake_intention_framed_dispatch.contract.json",
    "oracle/answers/775/handshake_intention_framed_dispatch.answer.jsonl",
    "oracle/test-manifests/775/handshake_intention_framed_dispatch.test-manifest.json",
    "oracle/failures/775/handshake_intention_framed_dispatch.why-what-answer.jsonl"
  ],
  "stop_condition": "The exact Rust oracle test passes, then the jar-backed oracle runner passes for this case and the full oracle_contracts Rust test surface passes without editing oracle expected-answer artifacts."
}
