{
  "task_id": "fix_configuration_code_of_conduct_clientbound_framed_dispatch_775",
  "case_id": "configuration_code_of_conduct_clientbound_framed_dispatch",
  "why": "Protocol 775 Configuration clientbound minecraft:code_of_conduct must dispatch through Stevenarella packet_by_id using the official framed packet id and official String body generated by the oracle answer. This is packet framing/dispatch/decode evidence for one String fixture only, not UI consent flow, legal acceptance semantics, Configuration completion, Play entry, world load, render readiness, or runtime behavior.",
  "what": "Stevenarella panics on official Configuration clientbound packet id 0x13 because the Protocol 775 table and bounded decoder do not include minecraft:code_of_conduct.",
  "answer_path": "oracle/answers/775/configuration_code_of_conduct_clientbound_framed_dispatch.answer.jsonl",
  "contract_path": "oracle/contracts/775/configuration_code_of_conduct_clientbound_framed_dispatch.contract.json",
  "failing_test": "cargo test --manifest-path oracle/rust-tests/Cargo.toml --test oracle_contracts configuration_code_of_conduct_clientbound_framed_dispatch_matches_official_oracle_answer -- --exact",
  "allowed_write_scope": [
    "stevenarella/protocol/src/protocol/mod.rs",
    "stevenarella/protocol/src/protocol/packet.rs",
    "stevenarella/protocol/src/protocol/versions/v26_1_2.rs"
  ],
  "forbidden_paths": [
    "oracle/cases/775/configuration_code_of_conduct_clientbound_framed_dispatch.json",
    "oracle/contracts/775/configuration_code_of_conduct_clientbound_framed_dispatch.contract.json",
    "oracle/answers/775/configuration_code_of_conduct_clientbound_framed_dispatch.answer.jsonl",
    "oracle/test-manifests/775/configuration_code_of_conduct_clientbound_framed_dispatch.test-manifest.json",
    "oracle/failures/775/configuration_code_of_conduct_clientbound_framed_dispatch.why-what-answer.jsonl"
  ],
  "stop_condition": "Stop after the named Rust oracle test dispatches the official clientbound code_of_conduct packet id 0x13, decodes and preserves the official String fixture bytes on the compatibility alias, and consumes the official body. Do not implement UI consent flow, legal acceptance semantics, Configuration-to-Play transition, Play readiness, or runtime behavior in this task."
}
