{
  "task_id": "fix_play_award_stats_clientbound_framed_dispatch_775",
  "case_id": "play_award_stats_clientbound_framed_dispatch",
  "why": "Protocol 775 Play clientbound minecraft:award_stats must dispatch through Stevenarella packet_by_id using the official framed packet id and empty-stats body generated by the oracle answer. This is packet-support evidence only, not non-empty Stat registry entry decoding, stat semantics, UI/stat screen behavior, spawn readiness, world load, render readiness, or client-load completion.",
  "what": "The exact Rust oracle test cannot compile because Packet::PlayAwardStatsClientbound does not exist, and the current Protocol 775 Play clientbound mapping has no official packet id 0x03 award_stats entry.",
  "answer_path": "oracle/answers/775/play_award_stats_clientbound_framed_dispatch.answer.jsonl",
  "contract_path": "oracle/contracts/775/play_award_stats_clientbound_framed_dispatch.contract.json",
  "failing_test": "cargo test --manifest-path oracle/rust-tests/Cargo.toml --test oracle_contracts play_award_stats_clientbound_framed_dispatch_matches_official_oracle_answer -- --exact",
  "allowed_write_scope": [
    "stevenarella/protocol/src/protocol/packet.rs",
    "stevenarella/protocol/src/protocol/mapped_packet.rs",
    "stevenarella/protocol/src/protocol/versions/v26_1_2.rs"
  ],
  "forbidden_paths": [
    "oracle/cases/775/play_award_stats_clientbound_framed_dispatch.json",
    "oracle/contracts/775/play_award_stats_clientbound_framed_dispatch.contract.json",
    "oracle/answers/775/play_award_stats_clientbound_framed_dispatch.answer.jsonl",
    "oracle/test-manifests/775/play_award_stats_clientbound_framed_dispatch.test-manifest.json",
    "oracle/failures/775/play_award_stats_clientbound_framed_dispatch.why-what-answer.jsonl"
  ],
  "stop_condition": "The exact Rust oracle test passes, then bash oracle/scripts/run_jar_backed_oracle_tests.sh passes without editing oracle expected-answer artifacts."
}
