{
  "task_id": "fix_login_cookie_request_clientbound_framed_dispatch_775",
  "case_id": "login_cookie_request_clientbound_framed_dispatch",
  "why": "Protocol 775 Login clientbound minecraft:cookie_request must dispatch through Stevenarella packet_by_id using the official framed packet id and key-only body generated by the oracle answer. This is packet-support evidence only, not cookie storage policy, cookie request/response runtime behavior, Login-to-Configuration state transition handling, Configuration entry, Play readiness, or client-load completion.",
  "what": "The exact Rust oracle test cannot compile because Packet::LoginCookieRequest does not exist, and the current Protocol 775 Login clientbound table has no mapping for official packet id 0x05.",
  "answer_path": "oracle/answers/775/login_cookie_request_clientbound_framed_dispatch.answer.jsonl",
  "contract_path": "oracle/contracts/775/login_cookie_request_clientbound_framed_dispatch.contract.json",
  "failing_test": "cargo test --manifest-path oracle/rust-tests/Cargo.toml --test oracle_contracts login_cookie_request_clientbound_framed_dispatch_matches_official_oracle_answer -- --exact",
  "allowed_write_scope": [
    "stevenarella/protocol/src/protocol/packet.rs",
    "stevenarella/protocol/src/protocol/mapped_packet.rs",
    "stevenarella/protocol/src/protocol/versions/v26_1_2.rs"
  ],
  "forbidden_paths": [
    "oracle/cases/775/login_cookie_request_clientbound_framed_dispatch.json",
    "oracle/contracts/775/login_cookie_request_clientbound_framed_dispatch.contract.json",
    "oracle/answers/775/login_cookie_request_clientbound_framed_dispatch.answer.jsonl",
    "oracle/test-manifests/775/login_cookie_request_clientbound_framed_dispatch.test-manifest.json",
    "oracle/failures/775/login_cookie_request_clientbound_framed_dispatch.why-what-answer.jsonl"
  ],
  "stop_condition": "The exact Rust oracle test passes, then bash oracle/scripts/run_jar_backed_oracle_tests.sh passes without editing oracle expected-answer artifacts."
}
