{
  "task_id": "fix_configuration_keepalive_clientbound_framed_dispatch_775",
  "case_id": "configuration_keepalive_clientbound_framed_dispatch",
  "why": "Protocol 775 Configuration clientbound keep_alive must dispatch through Stevenarella packet_by_id using the official framed packet id and body generated by the oracle answer. This packet-level proof is a prerequisite for a later runtime keep-alive echo harness.",
  "what": "The exact Rust oracle test panics while exercising packet::packet_by_id(775, State::Configuration, Direction::Clientbound, packet id 4, official body bytes) because the current Protocol 775 Configuration table has no clientbound mapping for packet id 0x04.",
  "answer_path": "oracle/answers/775/configuration_keepalive_clientbound_framed_dispatch.answer.jsonl",
  "contract_path": "oracle/contracts/775/configuration_keepalive_clientbound_framed_dispatch.contract.json",
  "failing_test": "cargo test --manifest-path oracle/rust-tests/Cargo.toml --test oracle_contracts configuration_keepalive_clientbound_framed_dispatch_decodes_official_oracle_answer -- --exact",
  "allowed_write_scope": [
    "stevenarella/protocol/src/protocol/mod.rs",
    "stevenarella/protocol/src/protocol/packet.rs",
    "stevenarella/protocol/src/protocol/versions/v26_1_2.rs"
  ],
  "forbidden_paths": [
    "oracle/cases/775/configuration_keepalive_clientbound_framed_dispatch.json",
    "oracle/contracts/775/configuration_keepalive_clientbound_framed_dispatch.contract.json",
    "oracle/answers/775/configuration_keepalive_clientbound_framed_dispatch.answer.jsonl",
    "oracle/test-manifests/775/configuration_keepalive_clientbound_framed_dispatch.test-manifest.json",
    "oracle/failures/775/configuration_keepalive_clientbound_framed_dispatch.why-what-answer.jsonl"
  ],
  "stop_condition": "bash oracle/scripts/run_jar_backed_oracle_tests.sh passes without editing oracle expected-answer artifacts."
}
